<?xml version="1.0" encoding="UTF-8"?>
<!ELEMENT purchaseOrder (shipTo,billTo,items,ship_date,ship_method)>
<!ELEMENT shipTo (name,street,city,state,zip)>
<!ELEMENT billTo (name,street,city,state,zip)>
<!ELEMENT ship_date (#PCDATA)>
<!ELEMENT ship_method (#PCDATA)>
<!ELEMENT name (#PCDATA)>
<!ELEMENT street (#PCDATA)>
<!ELEMENT city (#PCDATA)>
<!ELEMENT state (#PCDATA)>
<!ELEMENT zip (#PCDATA)>
<!ELEMENT items (item*)>
<!ELEMENT item (productName,quantity,USPrice)>
<!ELEMENT productName (#PCDATA)>
<!ELEMENT quantity (#PCDATA)>
<!ELEMENT USPrice (#PCDATA)>
<!ATTLIST purchaseOrder orderDate CDATA #REQUIRED>
<!ATTLIST shipTo country CDATA #REQUIRED>
<!ATTLIST billTo country CDATA #REQUIRED>
<!ATTLIST item partNum CDATA #REQUIRED>
<!ATTLIST ship_method type CDATA #REQUIRED>