<?xml version="1.0"?>
<!DOCTYPE purchaseOrder SYSTEM "myPOrder.dtd">
<purchaseOrder orderDate="20th of October 1999" >
	<shipTo country="Dubai">
		<name>Alice Smith</name>
		<street>123 Maple Street</street>
		<city>Mill Valley</city>
		<state>CA</state>
		<zip>90952</zip>
	</shipTo>
	<billTo country="Dubai">
		<name>Robert Smith</name>
		<street>8 Oak Avenue</street>
		<city>Old Town</city>
		<state>PA</state>
		<zip>95819</zip>
	</billTo>
	
	<items>
		<item partNum="AA-150">
			<productName>Lawnmower</productName>
			<quantity>1</quantity>
			<USPrice>148.95</USPrice>
		</item>
		<item partNum="AA-160">
			<productName>Baby Monitor</productName>
			<quantity>1</quantity>
			<USPrice>39.98</USPrice>
		</item>
	</items>
	<ship_date>30-10-1999</ship_date>
	<ship_method type="Shipping"/>
</purchaseOrder>
